{
  "schema_version": "1.0.0",
  "project": {
    "id": "untitled-project",
    "name": "Untitled Project",
    "created_at": "2026-06-24T13:50:20.472Z",
    "updated_at": "2026-06-24T13:50:20.472Z",
    "source_files": []
  },
  "units": {
    "area": "sf",
    "length": "ft",
    "coordinate": "model_units"
  },
  "calculation_rules": {
    "program_item_total_nsf": "quantity * nsf_per_unit",
    "department_net_nsf": "sum(program_item_total_nsf for program_items in department)",
    "department_gross_dgsf": "department_net_nsf * grossing_factor",
    "rounding": {
      "area_decimals": 2,
      "factor_decimals": 2
    }
  },
  "floors": [],
  "departments": [],
  "program_groups": [],
  "program_items": [],
  "drawings": [],
  "model_elements": [],
  "model_links": [],
  "derived_totals_cache": {
    "project_net_nsf": 0,
    "project_gross_dgsf": 0,
    "department_totals": []
  },
  "validation_issues": [],
  "extensions": {
    "created_in": "SIGNAL"
  }
}
